{
    "$schema": "http://json-schema.org/draft-07/schema#",
    "type": "object",
    "properties": {
      "style": {
        "type": "string",
        "enum": [
          "default"
        ]
      },
      "tailwind": {
        "type": "object",
        "properties": {
          "config": {
            "type": "string"
          },
          "css": {
            "type": "string"
          },
          "baseColor": {
            "type": "string"
          },
          "cssVariables": {
            "type": "boolean"
          },
          "prefix": {
            "type": "string"
          }
        },
        "required": [
          "config",
          "css",
          "cssVariables"
        ]
      },
      "rsc": {
        "type": "boolean"
      },
      "tsx": {
        "type": "boolean"
      },
      "iconLibrary": {
        "type": "string"
      },
      "aliases": {
        "type": "object",
        "properties": {
          "utils": {
            "type": "string"
          },
          "components": {
            "type": "string"
          },
          "ui": {
            "type": "string"
          },
          "lib": {
            "type": "string"
          },
          "hooks": {
            "type": "string"
          },
          "slices":{
            "type": "string"
          },
          "css": {
            "type": "string"
          }
        },
        "required": [
          "utils",
          "components"
        ]
      }
    },
    "required": [
      "style",
      "tailwind",
      "rsc",
      "aliases"
    ]
  }