{
  "$schema": "https://auradesignsystem.com/schema.json",
  "style": "default",
  "rsc": true,
  "tsx": true,
  "tailwind": {
    "config": "",
    "css": "app/globals.css",
    "baseColor": "default",
    "cssVariables": true
  },
  "aliases": {
    "components": "@/components",
    "utils": "@/utils/",
    "ui": "@/components/ui",
    "lib": "@/utils",
    "hooks": "@/hooks"
  },
  "iconLibrary": "radix-icons"
}
